{
  "$schema": "https://json-schema.org/draft/2020-12/schema",
  "$id": "urn:aseos:operation-schema:authority-lock:1.0.0",
  "x-schemaVersion": "1.0.0",
  "title": "ASEOS Phase 1 Authority Lock",
  "type": "object",
  "additionalProperties": false,
  "required": [
    "$schema",
    "schemaVersion",
    "lockId",
    "architectureBaselineCommit",
    "planningSourceCommit",
    "hashPolicy",
    "authorityFiles",
    "excludedSelfPath",
    "verificationRules"
  ],
  "properties": {
    "$schema": {
      "const": "urn:aseos:operation-schema:authority-lock:1.0.0"
    },
    "schemaVersion": {
      "const": "1.0.0"
    },
    "lockId": {
      "const": "P1-AUTHORITY-LOCK-1"
    },
    "architectureBaselineCommit": {
      "type": "string",
      "pattern": "^[0-9a-f]{40}$"
    },
    "planningSourceCommit": {
      "type": "string",
      "pattern": "^[0-9a-f]{40}$"
    },
    "hashPolicy": {
      "const": "SHA256_EXACT_UTF8_LF_FILE_BYTES"
    },
    "authorityFiles": {
      "type": "array",
      "minItems": 1,
      "items": {
        "type": "object",
        "additionalProperties": false,
        "required": [
          "path",
          "sha256",
          "role",
          "mutationPolicy",
          "allowedOperationIds"
        ],
        "properties": {
          "path": {
            "type": "string",
            "minLength": 1
          },
          "sha256": {
            "$ref": "urn:aseos:schema:common-identifiers:1.0.0#/$defs/sha256"
          },
          "role": {
            "type": "string",
            "minLength": 1
          },
          "mutationPolicy": {
            "enum": [
              "IMMUTABLE",
              "OPERATION_SCOPED"
            ]
          },
          "allowedOperationIds": {
            "type": "array",
            "uniqueItems": true,
            "items": {
              "enum": [
                "P1-O01",
                "P1-O02",
                "P1-O03",
                "P1-O04",
                "P1-O05",
                "P1-O06",
                "P1-O07",
                "P1-O08",
                "P1-O09"
              ]
            }
          }
        }
      }
    },
    "excludedSelfPath": {
      "const": "operations/phase-1/authority-lock.json"
    },
    "verificationRules": {
      "type": "array",
      "minItems": 1,
      "uniqueItems": true,
      "items": {
        "type": "string",
        "minLength": 1
      }
    }
  }
}
